address,comment,id,link,originPrice,shop,title

